{
  "$schema": "./schemas/state-machine.schema.json",
  "schema_version": "1",
  "description": "Noetic-dev delivery governance state machine — states, transitions, and role authorities.",
  "states": {
    "UNGOVERNED_EXISTING": {
      "description": "Existing branches/PRs before governance was applied.",
      "authorized_roles": ["orchestrator"]
    },
    "AUDIT_REQUIRED": {
      "description": "Audit is needed before any transition.",
      "authorized_roles": ["orchestrator"]
    },
    "AUDITED": {
      "description": "Audit complete; ready for issue acceptance.",
      "authorized_roles": ["orchestrator", "reviewer"]
    },
    "ISSUE_ACCEPTED": {
      "description": "Issue is accepted for governed work.",
      "authorized_roles": ["orchestrator"]
    },
    "PLAN_REQUESTED": {
      "description": "A planning pass has been requested.",
      "authorized_roles": ["orchestrator"]
    },
    "PLAN_READY": {
      "description": "Planning pass complete and plan approved.",
      "authorized_roles": ["orchestrator", "reviewer"]
    },
    "IMPLEMENTING": {
      "description": "Implementation generation in progress.",
      "authorized_roles": ["implementer"]
    },
    "CANDIDATE_PINNED": {
      "description": "Implementation candidate SHA pinned; ready for validation and QA.",
      "authorized_roles": ["implementer", "validator", "qa"]
    },
    "VALIDATING": {
      "description": "Validation running against candidate SHA.",
      "authorized_roles": ["validator"]
    },
    "QA_RUNNING": {
      "description": "Adversarial QA running against pinned candidate.",
      "authorized_roles": ["qa"]
    },
    "QA_FAILED": {
      "description": "QA found defects; remediation required.",
      "authorized_roles": ["qa", "orchestrator"]
    },
    "REMEDIATING": {
      "description": "Remediation generation in progress (new implementation pass).",
      "authorized_roles": ["remediator"]
    },
    "QA_PASSED": {
      "description": "QA verdict passed.",
      "authorized_roles": ["qa"]
    },
    "INDEPENDENT_REVIEW_PENDING": {
      "description": "Candidate ready for independent high-reasoning Fable or Sol review.",
      "authorized_roles": ["reviewer"]
    },
    "READY_TO_INTEGRATE_DEV": {
      "description": "Feature candidate approved for squash integration into protected dev.",
      "authorized_roles": ["publisher"]
    },
    "MERGED_TO_DEV": {
      "description": "Feature candidate integrated into protected dev; post-integration validation pending.",
      "authorized_roles": ["publisher"]
    },
    "POST_DEV_VALIDATING": {
      "description": "Validation running against the exact protected dev integration SHA.",
      "authorized_roles": ["validator"]
    },
    "MAIN_PROMOTION_PENDING": {
      "description": "Validated dev work is eligible to request, but does not yet have, owner authorization for promotion to main.",
      "authorized_roles": ["owner"]
    },
    "MAIN_PROMOTION_AUTHORIZED": {
      "description": "The repository owner authorized a bounded promotion candidate from exact dev to main.",
      "authorized_roles": ["owner", "orchestrator"]
    },
    "READY_TO_MERGE": {
      "description": "The separately validated and reviewed promotion candidate is ready for the protected exact main ref-update operation.",
      "authorized_roles": ["publisher"]
    },
    "MERGED_TO_MAIN": {
      "description": "Protected main was atomically fast-forwarded to the exact candidate SHA; post-update validation is pending.",
      "authorized_roles": ["publisher"]
    },
    "POST_MERGE_VALIDATING": {
      "description": "Post-merge validation running against main.",
      "authorized_roles": ["validator"]
    },
    "PUBLICATION_READY": {
      "description": "Post-merge validation passed; ready to publish.",
      "authorized_roles": ["publisher"]
    },
    "PUBLISHED": {
      "description": "Tagged/released to the public.",
      "authorized_roles": ["publisher"]
    },
    "DEPLOYED": {
      "description": "Released version deployed.",
      "authorized_roles": ["publisher"]
    },
    "BLOCKED": {
      "description": "State blocked until its named condition is resolved by an authorized agent role.",
      "authorized_roles": ["orchestrator", "reviewer"]
    },
    "ABORTED": {
      "description": "Work terminated; terminal state.",
      "authorized_roles": ["orchestrator"]
    },
    "ROLLED_BACK": {
      "description": "Published/deployed work rolled back; terminal state.",
      "authorized_roles": ["orchestrator"]
    }
  },
  "transitions": [
    {"from": "UNGOVERNED_EXISTING", "to": "AUDIT_REQUIRED", "authorized_roles": ["orchestrator"], "conditions": ["governance correction bootstrap initiated"]},
    {"from": "AUDIT_REQUIRED", "to": "AUDITED", "authorized_roles": ["orchestrator", "reviewer"], "conditions": ["audit artifacts stored in governance/audits/", "independent audit review passed"]},
    {"from": "AUDITED", "to": "ISSUE_ACCEPTED", "authorized_roles": ["orchestrator"], "conditions": ["issue has valid status:* label", "not status:blocked", "not status:checkpointed"]},
    {"from": "ISSUE_ACCEPTED", "to": "PLAN_REQUESTED", "authorized_roles": ["orchestrator"], "conditions": ["planning pass authorized"]},
    {"from": "PLAN_REQUESTED", "to": "PLAN_READY", "authorized_roles": ["orchestrator"], "conditions": ["plan artifact exists", "plan reviewed"]},
    {"from": "PLAN_READY", "to": "IMPLEMENTING", "authorized_roles": ["orchestrator"], "conditions": ["plan accepted"]},
    {"from": "IMPLEMENTING", "to": "CANDIDATE_PINNED", "authorized_roles": ["implementer"], "conditions": ["candidate commit created", "full 40-char SHA recorded"]},
    {"from": "CANDIDATE_PINNED", "to": "VALIDATING", "authorized_roles": ["validator"], "conditions": ["candidate SHA is immutable"]},
    {"from": "CANDIDATE_PINNED", "to": "QA_RUNNING", "authorized_roles": ["qa"], "conditions": ["candidate SHA pinned", "validation may be concurrent"]},
    {"from": "VALIDATING", "to": "CANDIDATE_PINNED", "authorized_roles": ["validator"], "conditions": ["validation completed (pass or fail)"]},
    {"from": "QA_RUNNING", "to": "QA_PASSED", "authorized_roles": ["qa"], "conditions": ["exactly one QA pass", "QA verdict passed", "QA used read-only source mount", "QA event log verified"]},
    {"from": "QA_RUNNING", "to": "QA_FAILED", "authorized_roles": ["qa"], "conditions": ["QA verdict failed"]},
    {"from": "QA_FAILED", "to": "REMEDIATING", "authorized_roles": ["orchestrator"], "conditions": ["remediation authorized"]},
    {"from": "REMEDIATING", "to": "CANDIDATE_PINNED", "authorized_roles": ["remediator"], "conditions": ["new implementation_pass_id", "new candidate SHA", "new qa_for_pass_id"]},
    {"from": "QA_PASSED", "to": "INDEPENDENT_REVIEW_PENDING", "authorized_roles": ["qa"], "conditions": ["all validations passed", "QA passed"]},
    {"from": "INDEPENDENT_REVIEW_PENDING", "to": "READY_TO_INTEGRATE_DEV", "authorized_roles": ["reviewer"], "conditions": ["PR base is protected dev", "independent Fable or Sol approval after candidate SHA", "high reasoning used", "not approved by PR author, implementer, or QA identity"]},
    {"from": "INDEPENDENT_REVIEW_PENDING", "to": "READY_TO_MERGE", "authorized_roles": ["reviewer"], "conditions": ["PR base is protected main", "owner promotion authorization exists for exact dev SHA", "independent Fable or Sol approval after candidate SHA", "high reasoning used", "not approved by PR author, implementer, or QA identity"]},
    {"from": "INDEPENDENT_REVIEW_PENDING", "to": "BLOCKED", "authorized_roles": ["reviewer"], "conditions": ["independent reviewer rejects candidate"]},
    {"from": "READY_TO_INTEGRATE_DEV", "to": "MERGED_TO_DEV", "authorized_roles": ["publisher"], "conditions": ["squash merge to protected dev", "dev integration SHA recorded"]},
    {"from": "MERGED_TO_DEV", "to": "POST_DEV_VALIDATING", "authorized_roles": ["validator"], "conditions": ["post-integration validation running against exact dev SHA"]},
    {"from": "POST_DEV_VALIDATING", "to": "MAIN_PROMOTION_PENDING", "authorized_roles": ["validator"], "conditions": ["post-integration validations and tests pass", "exact dev SHA recorded"]},
    {"from": "MAIN_PROMOTION_PENDING", "to": "MAIN_PROMOTION_AUTHORIZED", "authorized_roles": ["owner"], "conditions": ["protected external evidence binds repository-owner identity, issue 32 authorization record, timestamp, and exact dev SHA"]},
    {"from": "MAIN_PROMOTION_AUTHORIZED", "to": "CANDIDATE_PINNED", "authorized_roles": ["orchestrator"], "conditions": ["promotion PR targets protected main", "promotion head equals authorized dev SHA", "new implementation_pass_id and qa_for_pass_id allocated"]},
    {"from": "READY_TO_MERGE", "to": "MERGED_TO_MAIN", "authorized_roles": ["publisher"], "conditions": ["promotion PR required checks passed against exact authorized dev SHA", "authenticated comparison proves expected old main SHA is the merge base and authorized candidate is strictly ahead", "protected main head equals expected old main SHA", "main.promote_exact root-owned publisher verifies protected authorization and executes /usr/bin/git push --porcelain with force-with-lease for the expected old main SHA", "authenticated publisher execution record binds the exact argv, result, and chronology", "source SHA equals owner-authorized and protected-validated dev candidate SHA", "protected main readback and merge_result_sha equal the exact candidate SHA", "squash, rebase, and merge commits are forbidden"]},
    {"from": "MERGED_TO_MAIN", "to": "POST_MERGE_VALIDATING", "authorized_roles": ["validator"], "conditions": ["post-merge validation running against main SHA"]},
    {"from": "POST_MERGE_VALIDATING", "to": "PUBLICATION_READY", "authorized_roles": ["validator"], "conditions": ["post-merge validations and tests pass"]},